{
  "adjudication_required": false,
  "baseline_supported": true,
  "capture_limitations": [],
  "case_id": "public-5gc-access-plmn-recovery",
  "comparison_eligibility": "ELIGIBLE",
  "comparison_status": "DOMAIN_COVERAGE_GAP",
  "evidence_layers": {
    "baseline_support": "SUPPORTED",
    "capture_sufficiency": "SUFFICIENT",
    "domain_reconstruction": "NOT_APPLICABLE",
    "orchestration_availability": "NOT_APPLICABLE",
    "protocol_extraction": "HEALTHY",
    "semantic_comparison": "NOT_EVALUATED"
  },
  "evidence_overlap": false,
  "frame_delta": null,
  "human_baseline_sha256": "6eaf5d92ec164e7d0000b781bb32e2c9fbccfd73bd2605767eaa4b3a8b18b645",
  "human_boundary": {
    "analysis_status": "NO_SUPPORTED_ABNORMAL_BOUNDARY_OBSERVED",
    "frame_number": null,
    "message_type": null,
    "procedure_family": null,
    "procedure_stage": null,
    "protocol": null
  },
  "layer_attribution": "DOMAIN_COVERAGE",
  "notes": [
    "Observed procedure family is not owned by any implemented Domain Skill: ngap-management. This is unimplemented Domain coverage, not an implemented Domain reconstruction failure."
  ],
  "recommended_next_action": "EXPAND_FUTURE_SCOPE",
  "skill_boundary": {
    "boundary_frame": null,
    "boundary_message": null,
    "boundary_protocol": null,
    "procedure_family": null,
    "procedure_stage": null,
    "selection_status": "NO_DOMAIN_INPUTS",
    "source_domain": null
  },
  "upstream_intent_match": "PARTIAL"
}
