{
  "adjudication_required": true,
  "baseline_supported": true,
  "capture_limitations": [
    "Capture contains periodic SCTP heartbeats before UE registration starts"
  ],
  "case_id": "public-5gc-registration-resync",
  "comparison_eligibility": "ELIGIBLE",
  "comparison_status": "NEEDS_ADJUDICATION",
  "evidence_layers": {
    "baseline_support": "SUPPORTED",
    "capture_sufficiency": "SUFFICIENT",
    "domain_reconstruction": "PRESENT",
    "orchestration_availability": "AVAILABLE",
    "protocol_extraction": "HEALTHY",
    "semantic_comparison": "EVALUATED"
  },
  "evidence_overlap": false,
  "frame_delta": null,
  "human_baseline_sha256": "a51c0e534c9f7c97365e4fdb300ebc47b7d53cec36261160dec7804972ccd317",
  "human_boundary": {
    "analysis_status": "NO_SUPPORTED_ABNORMAL_BOUNDARY_OBSERVED",
    "frame_number": null,
    "message_type": null,
    "procedure_family": null,
    "procedure_stage": null,
    "protocol": null
  },
  "layer_attribution": "MULTIPLE",
  "notes": [
    "3 candidate boundaries were emitted but no boundary was selected; Orchestration preserved the ambiguity (AMBIGUOUS_FIRST_BOUNDARY).",
    "A confirmed FALSE_POSITIVE requires independent adjudication that a candidate boundary is unsupported by the packet evidence; candidate evidence here may be spurious, which is not yet proven.",
    "Relevant Domain instance(s) reported 13 deviation(s) on a capture the independent baseline records as healthy, so the candidate evidence needs Domain-layer review."
  ],
  "recommended_next_action": "NO_CHANGE",
  "skill_boundary": {
    "boundary_frame": null,
    "boundary_message": null,
    "boundary_protocol": null,
    "procedure_family": null,
    "procedure_stage": null,
    "selection_status": "AMBIGUOUS_FIRST_BOUNDARY",
    "source_domain": null
  },
  "upstream_intent_match": "MISMATCH"
}
