{
  "adjudication_required": true,
  "baseline_supported": true,
  "capture_limitations": [
    "PFCP Session Deletion at frame 2-3 reflects startup environment cleanup"
  ],
  "case_id": "public-5gc-baseline-user-plane",
  "comparison_eligibility": "ELIGIBLE",
  "comparison_status": "NEEDS_ADJUDICATION",
  "evidence_layers": {
    "baseline_support": "SUPPORTED",
    "capture_sufficiency": "SUFFICIENT",
    "domain_reconstruction": "PRESENT",
    "orchestration_availability": "AVAILABLE",
    "protocol_extraction": "HEALTHY",
    "semantic_comparison": "EVALUATED"
  },
  "evidence_overlap": false,
  "frame_delta": null,
  "human_baseline_sha256": "81f4740c17d638a2a4e9e2339114f15fce6a4beb6b7f0aa2cd142c5833fed6ae",
  "human_boundary": {
    "analysis_status": "NO_SUPPORTED_ABNORMAL_BOUNDARY_OBSERVED",
    "frame_number": null,
    "message_type": null,
    "procedure_family": null,
    "procedure_stage": null,
    "protocol": null
  },
  "layer_attribution": "DOMAIN",
  "notes": [
    "Pipeline selected no abnormal boundary, but the relevant Domain instance(s) reported 6 deviation(s) on a capture the independent baseline records as healthy."
  ],
  "recommended_next_action": "CORRECT_DOMAIN_MODEL",
  "skill_boundary": {
    "boundary_frame": null,
    "boundary_message": null,
    "boundary_protocol": null,
    "procedure_family": null,
    "procedure_stage": null,
    "selection_status": "NO_ABNORMAL_BOUNDARY_OBSERVED",
    "source_domain": null
  },
  "upstream_intent_match": "MISMATCH"
}
